<art xmlns:xsi="http://www.w3.org/2001/XMLSchema-instance" xsi:noNamespaceSchemaLocation="art.xsd">
  <artists>
    <artist aid="0">
      <name>Pablo Picasso</name>
      <lived birthplace="Spain" from="1881-10-25" to="1973-04-07"/>
      <tags>
	<t>Picasso</t>
	<t>Spain</t>
      </tags>
    </artist>
  </artists>
  
  <objects>
    

    <object>
      <title>Tod und Leben</title>
      <kind>
<painting on="Canvas" paint="Oil"/>
</kind>
      <label>
	Painted by <by>Gustav Klimt</by> in different years: <year>1921</year> and <year>1924</year>.
      </label>
      <catalog>GK-230-t0</catalog>
      <tags>
	<t>Jugendstil</t>
      </tags>
    </object>

    <object>
      <title>Statue des hl. Leopold</title>
      <kind>
<sculpture material="stone"/>
</kind>
      <label>
	Eine von zwei Statuen auf der Kirche am Steinhof, eines der
	Hauptwerke des <ref>Jugendstil</ref>. Wie auch die Kirche von
	<by>Otto Wagner</by> konzipiert.
      </label>
      <tags>
	<t>Jugendstil</t>
      </tags>
      <catalog>XY-234-x3</catalog>
    </object>
  <object>
<title>Mona Lisa</title>
<kind>
<painting on="panel" paint="Oil"/>
</kind>
<label>This object was created by <by>Leonardo di ser Piero da Vinci</by> in the year <year>1513</year>. The best known, the most visited, the most written about, the most sung about, the most parodied work of art in the world.</label>
<catalog>EX-004-a0</catalog>
<tags>
<t>Renaissance</t>
<t>Italy</t>
</tags>
</object>
<object>
<title>David</title>
<kind>
<sculpture/>
</kind>
<label>This object was created by <by>Michelangelo di Lodovico Buonarroti Simoni</by> in the year <year>1504</year>. David is a masterpiece of Renaissance sculpture created in marble. David is a 5.17-metre (17.0 ft) marble statue of the Biblical hero David, a favoured subject in the art of Florence. </label>
<catalog>EX-004-a0</catalog>
<tags>
<t>Renaissance</t>
</tags>
</object>
<object>
<title>Black Square</title>
<kind>
<painting on="linen" paint="Oil"/>
</kind>
<label>This object was created by <by>Kazimir Malevich</by> in the year <year>1915</year>. This work is frequently invoked by critics, historians, curators, and artists as the "zero point of painting".</label>
<catalog>EX-004-a0</catalog>
<tags>
<t>Suprematism</t>
<t>Russia</t>
</tags>
</object>
</objects>
    
  <tags>
    <tag tagname="Cubism">
      Style of painting born in the early 20th century which abstracts
      by reducing subjects to geometric outlines.
    </tag>
    <tag tagname="Jugendstil">
    </tag>
    <tag tagname="Picasso">
    </tag>
    <tag tagname="Spain">
    </tag>
  <tag tagname="Renaissance"/>
<tag tagname="Italy"/>
<tag tagname="Suprematism"/>
<tag tagname="Russia"/>
</tags>
</art>
